{
  "format": 1,
  "id": "01M4QHMS4JTBGD9PVWF1C97TRS",
  "subject": "vitest",
  "package": {
    "ecosystem": "npm",
    "name": "vitest"
  },
  "versions": ">=5.0.0",
  "kind": "default",
  "symbol": "clearMocks",
  "signal": "silent",
  "detail": "clearMocks default is true: Vitest automatically calls vi.clearAllMocks before each test.",
  "evidence": [
    {
      "test": {
        "runtime": "node@24",
        "packages": {
          "vitest": "5.0.0"
        },
        "code": "const fs = require(\"fs\");\nconst path = require(\"path\");\nconst cp = require(\"child_process\");\nconst dir = \"/w/clearmocks\";\nfs.rmSync(dir, { recursive: true, force: true });\nfs.mkdirSync(dir, { recursive: true });\nfs.writeFileSync(path.join(dir, \"mock.test.mjs\"), [\n  \"import { test, vi } from 'vitest'\",\n  \"import { writeFileSync } from 'node:fs'\",\n  \"const fn = vi.fn()\",\n  \"test('first', () => { fn(); fn() })\",\n  \"test('second', () => { writeFileSync(new URL('./calls.txt', import.meta.url), String(fn.mock.calls.length)) })\",\n].join(\"\\n\") + \"\\n\");\nconst r = cp.spawnSync(process.execPath, [\"/w/node_modules/vitest/vitest.mjs\", \"run\"], {\n  cwd: dir,\n  encoding: \"utf8\",\n  env: { ...process.env, NO_COLOR: \"1\", CI: \"1\" },\n  timeout: 60000,\n});\nconsole.log((r.stdout || \"\") + (r.stderr || \"\") + (r.error ? String(r.error) : \"\"));\nconst callsFile = path.join(dir, \"calls.txt\");\nif (r.status !== 0 || !fs.existsSync(callsFile)) {\n  console.error(\"ERROR: vitest run did not complete (exit \" + r.status + \")\");\n  process.exit(2);\n}\nconst calls = fs.readFileSync(callsFile, \"utf8\").trim();\nif (calls === \"0\") {\n  console.log(\"PASS: mock history was cleared before the second test\");\n  process.exit(0);\n}\nif (calls === \"2\") {\n  console.error(\"FAIL: mock calls from the first test were still recorded in the second test\");\n  process.exit(1);\n}\nconsole.error(\"ERROR: unexpected mock call count \" + calls);\nprocess.exit(2);\n",
        "expect": "pass"
      }
    },
    {
      "test": {
        "runtime": "node@24",
        "packages": {
          "vitest": "4.1.11"
        },
        "code": "const fs = require(\"fs\");\nconst path = require(\"path\");\nconst cp = require(\"child_process\");\nconst dir = \"/w/clearmocks\";\nfs.rmSync(dir, { recursive: true, force: true });\nfs.mkdirSync(dir, { recursive: true });\nfs.writeFileSync(path.join(dir, \"mock.test.mjs\"), [\n  \"import { test, vi } from 'vitest'\",\n  \"import { writeFileSync } from 'node:fs'\",\n  \"const fn = vi.fn()\",\n  \"test('first', () => { fn(); fn() })\",\n  \"test('second', () => { writeFileSync(new URL('./calls.txt', import.meta.url), String(fn.mock.calls.length)) })\",\n].join(\"\\n\") + \"\\n\");\nconst r = cp.spawnSync(process.execPath, [\"/w/node_modules/vitest/vitest.mjs\", \"run\"], {\n  cwd: dir,\n  encoding: \"utf8\",\n  env: { ...process.env, NO_COLOR: \"1\", CI: \"1\" },\n  timeout: 60000,\n});\nconsole.log((r.stdout || \"\") + (r.stderr || \"\") + (r.error ? String(r.error) : \"\"));\nconst callsFile = path.join(dir, \"calls.txt\");\nif (r.status !== 0 || !fs.existsSync(callsFile)) {\n  console.error(\"ERROR: vitest run did not complete (exit \" + r.status + \")\");\n  process.exit(2);\n}\nconst calls = fs.readFileSync(callsFile, \"utf8\").trim();\nif (calls === \"0\") {\n  console.log(\"PASS: mock history was cleared before the second test\");\n  process.exit(0);\n}\nif (calls === \"2\") {\n  console.error(\"FAIL: mock calls from the first test were still recorded in the second test\");\n  process.exit(1);\n}\nconsole.error(\"ERROR: unexpected mock call count \" + calls);\nprocess.exit(2);\n",
        "expect": "fail",
        "error": "FAIL: mock calls from the first test were still recorded in the second test"
      }
    },
    {
      "source": {
        "url": "https://raw.githubusercontent.com/vitest-dev/vitest/v5.0.0/docs/config/clearmocks.md",
        "quote": "clearMocks\n\n- **Type:** `boolean`\n- **Default:** `true`\n\nShould Vitest automatically call [`vi.clearAllMocks()`](/api/vi#vi-clearallmocks) before each test."
      }
    }
  ],
  "author": "github:Ludion-ai",
  "author_id": 292738933,
  "drafted_by": "agent",
  "created_at": "2026-10-12T07:53:41Z"
}
