{
  "format": 1,
  "id": "01M4QH98JRND3BARBYA0RGY08M",
  "subject": "agents",
  "package": {
    "ecosystem": "npm",
    "name": "agents"
  },
  "versions": ">=0.23.0",
  "kind": "behavior",
  "symbol": "browser_execute",
  "signal": "silent",
  "detail": "browser_execute no longer sends the durable calls log to the model; the persisted tool part keeps it for UIs and audit.",
  "evidence": [
    {
      "test": {
        "runtime": "node@24",
        "packages": {
          "agents": "0.23.0"
        },
        "code": "const fs = require(\"fs\");\nconst path = require(\"path\");\nconst os = require(\"os\");\nconst root = \"/w/node_modules/agents\";\nconst pkg = JSON.parse(fs.readFileSync(path.join(root, \"package.json\"), \"utf8\"));\nconst exp = pkg.exports && pkg.exports[\"./browser/ai\"];\nif (!exp || !exp.import) {\n  console.error(\"ERROR: agents \" + pkg.version + \" has no ./browser/ai export\");\n  process.exit(2);\n}\nlet src = fs.readFileSync(path.join(root, exp.import), \"utf8\");\n// Stub the peer/internal imports so only the shipped browser_execute tool code runs.\nsrc = src.replace(/^import[^\\r\\n]*/gm, \"\");\nconst stubs = `\nconst chain = new Proxy(function () {}, { get: (t, k) => (k === \"then\" ? undefined : chain), apply: () => chain });\nconst z = chain;\nconst tool = (def) => def;\nconst __DO_NOT_USE_WILL_BREAK__agentContext = { getStore: () => undefined };\nclass BrowserConnector { constructor() {} }\nclass DurableBrowserSessionStore { constructor() {} }\nclass DynamicWorkerExecutor { constructor() {} }\nconst browserLinks = chain, browserScrape = chain, browserMarkdown = chain, browserContent = chain, browserExtract = chain;\nconst truncateResult = (v) => v;\nconst createCodemodeRuntime = () => ({ tool: () => ({ description: \"stub\" }) });\n`;\nconst file = path.join(os.tmpdir(), \"ludion-browser-ai-\" + process.pid + \".mjs\");\nfs.writeFileSync(file, stubs + src);\nconsole.warn = () => {};\nconsole.debug = () => {};\nimport(require(\"url\").pathToFileURL(file).href).then(async (mod) => {\n  if (typeof mod.createBrowserRuntime !== \"function\") {\n    console.error(\"ERROR: createBrowserRuntime missing\");\n    process.exit(2);\n  }\n  const { tools } = mod.createBrowserRuntime({ ctx: {}, cdpUrl: \"ws://127.0.0.1:1\", quickActions: false });\n  const t = tools && tools.browser_execute;\n  if (!t || typeof t.toModelOutput !== \"function\") {\n    console.error(\"ERROR: browser_execute has no toModelOutput\");\n    process.exit(2);\n  }\n  const output = {\n    status: \"completed\",\n    executionId: \"exec-1\",\n    result: \"ok\",\n    calls: [{ connector: \"cdp\", method: \"send\", args: [\"Page.navigate\"], result: { frameId: \"f1\" } }]\n  };\n  const out = await t.toModelOutput({ toolCallId: \"tc-1\", input: { code: \"x\" }, output });\n  if (!out || out.type !== \"json\" || !out.value || out.value.result !== \"ok\" || out.value.status !== \"completed\") {\n    console.error(\"ERROR: unexpected model output \" + JSON.stringify(out));\n    process.exit(2);\n  }\n  if (!Array.isArray(output.calls) || output.calls.length !== 1) {\n    console.error(\"ERROR: persisted output was mutated\");\n    process.exit(2);\n  }\n  if (\"calls\" in out.value) {\n    console.error(\"FAIL: browser_execute model output still includes the calls log\");\n    process.exit(1);\n  }\n  console.log(\"OK: agents \" + pkg.version + \" browser_execute model output omits calls: \" + JSON.stringify(out.value));\n  process.exit(0);\n}).catch((e) => {\n  console.error(\"ERROR: \" + (e && e.message));\n  process.exit(2);\n});\n",
        "expect": "pass"
      }
    },
    {
      "test": {
        "runtime": "node@24",
        "packages": {
          "agents": "0.22.0"
        },
        "code": "const fs = require(\"fs\");\nconst path = require(\"path\");\nconst os = require(\"os\");\nconst root = \"/w/node_modules/agents\";\nconst pkg = JSON.parse(fs.readFileSync(path.join(root, \"package.json\"), \"utf8\"));\nconst exp = pkg.exports && pkg.exports[\"./browser/ai\"];\nif (!exp || !exp.import) {\n  console.error(\"ERROR: agents \" + pkg.version + \" has no ./browser/ai export\");\n  process.exit(2);\n}\nlet src = fs.readFileSync(path.join(root, exp.import), \"utf8\");\n// Stub the peer/internal imports so only the shipped browser_execute tool code runs.\nsrc = src.replace(/^import[^\\r\\n]*/gm, \"\");\nconst stubs = `\nconst chain = new Proxy(function () {}, { get: (t, k) => (k === \"then\" ? undefined : chain), apply: () => chain });\nconst z = chain;\nconst tool = (def) => def;\nconst __DO_NOT_USE_WILL_BREAK__agentContext = { getStore: () => undefined };\nclass BrowserConnector { constructor() {} }\nclass DurableBrowserSessionStore { constructor() {} }\nclass DynamicWorkerExecutor { constructor() {} }\nconst browserLinks = chain, browserScrape = chain, browserMarkdown = chain, browserContent = chain, browserExtract = chain;\nconst truncateResult = (v) => v;\nconst createCodemodeRuntime = () => ({ tool: () => ({ description: \"stub\" }) });\n`;\nconst file = path.join(os.tmpdir(), \"ludion-browser-ai-\" + process.pid + \".mjs\");\nfs.writeFileSync(file, stubs + src);\nconsole.warn = () => {};\nconsole.debug = () => {};\nimport(require(\"url\").pathToFileURL(file).href).then(async (mod) => {\n  if (typeof mod.createBrowserRuntime !== \"function\") {\n    console.error(\"ERROR: createBrowserRuntime missing\");\n    process.exit(2);\n  }\n  const { tools } = mod.createBrowserRuntime({ ctx: {}, cdpUrl: \"ws://127.0.0.1:1\", quickActions: false });\n  const t = tools && tools.browser_execute;\n  if (!t || typeof t.toModelOutput !== \"function\") {\n    console.error(\"ERROR: browser_execute has no toModelOutput\");\n    process.exit(2);\n  }\n  const output = {\n    status: \"completed\",\n    executionId: \"exec-1\",\n    result: \"ok\",\n    calls: [{ connector: \"cdp\", method: \"send\", args: [\"Page.navigate\"], result: { frameId: \"f1\" } }]\n  };\n  const out = await t.toModelOutput({ toolCallId: \"tc-1\", input: { code: \"x\" }, output });\n  if (!out || out.type !== \"json\" || !out.value || out.value.result !== \"ok\" || out.value.status !== \"completed\") {\n    console.error(\"ERROR: unexpected model output \" + JSON.stringify(out));\n    process.exit(2);\n  }\n  if (!Array.isArray(output.calls) || output.calls.length !== 1) {\n    console.error(\"ERROR: persisted output was mutated\");\n    process.exit(2);\n  }\n  if (\"calls\" in out.value) {\n    console.error(\"FAIL: browser_execute model output still includes the calls log\");\n    process.exit(1);\n  }\n  console.log(\"OK: agents \" + pkg.version + \" browser_execute model output omits calls: \" + JSON.stringify(out.value));\n  process.exit(0);\n}).catch((e) => {\n  console.error(\"ERROR: \" + (e && e.message));\n  process.exit(2);\n});\n",
        "expect": "fail",
        "error": "FAIL: browser_execute model output still includes the calls log"
      }
    },
    {
      "source": {
        "url": "https://raw.githubusercontent.com/cloudflare/agents/agents@0.23.0/packages/agents/CHANGELOG.md",
        "quote": "`browser_execute` no longer sends the durable `calls` log to the model. The persisted tool part keeps it for UIs and audit, matching the Code Mode tool's own projection."
      }
    }
  ],
  "author": "github:Ludion-ai",
  "author_id": 292738933,
  "drafted_by": "agent",
  "created_at": "2026-10-12T07:47:23Z"
}
